loca_key_foo;Value is Bar
a16_adil_start_01;Ce que j'aime chez lui, c'est pas sa beauté. Et ce n'est pas qu'il soit un voleur habile, qu'il soit intelligent ou qu'il m'aime. C'est son caractère. Il a de nombreuses raisons d'être cynique ou amer, mais il ne l'est pas. Il profite de la vie. Il voit le positif chez tout le monde et dans toutes les situations. Il est humble et peut trouver de la joie dans de petites choses. \n Je n'ai jamais pensé a faire des enfants jusqu'à notre rencontre. Il serait un père fantastique. Il enseignerait à nos enfants la façon d'avoir une vision positive de la vie. Ne pas laisser les circonstances les broyer. Il leur donnerait tout ce dont ils ont besoin pour vivre une vie satisfaisante.
index_note_plan_01;Le Plan
a16_plan_talk_about_01;Notre plan est simple: à Londres, je vais interchanger l'oeil volé du Sphinx pour un faux. Inch pourra jeter un coup d'oeil à la pierre, mais il n'aura pas l'occasion de l'expertiser soigneusement et nous espérons qu'il ne remarquera pas quelque chose qui cloche. Nous irons prendre le second joyau du Caire. Inch pensera qu'il a tout sous contrôle... Et avant qu'il ne comprenne, nous serons partis depuis longtemps.
a16_plan_corps_seen_01;Cela ne faisait pas partie du plan ! Absolument pas. Qui a tué la baronne ? Inch ? Mais pourquoi ? C'est pas bon. Pas bon du tout.
a16_plan_arab_arrested_01;Adil s'est fait attraper. C'est une situation dangereuse. S'ils ne trouvent pas le meurtrier, ils pourraient essayer de tout lui mettre sur le dos. Et même si ils ne le font pas, ça pourrait prendre des jours avant qu'il soit relâché !
a19_plan_start_01;L'assassinat de la Baronne von Trebitz était une diversion indésirable. Mais j'ai le sentiment que le plan est de nouveau sur la bonne voie. Inch pense qu'il a tout sous contrôle. Sa fin est proche.
a20_plan_left_ravensnest_01;Rien ne lui arrivera. Rien ne peut lui arriver ! Je déteste ne pas pouvoir être avec elle. Elle peut prendre soin d'elle, je le sais. Mais Alex, seul avec ce dingue ? Il ne faut pas que j'y pense. Je dois me concentrer sur mon travail.
index_note_mayers_01;Patricia Mayers
a16_mayers_talk_arab_plan_01;Patricia Mayers est un de mes personnages préférés. Une jolie fille de bonne famille... Personne ne s'attend - ou suspects - rien d'elle. Il y a un seul problème... Les gens qui pensent que Patricia est idiote, même s'ils ne la connaissent pas. Une blonde gâté idiote qui donne toujours des répliques intelligentes - c'est pas la meilleure couverture. Je dois y travailler.
a16_mayers_talk_fiddler_01;C'est incroyable. Patricia attire vraiment les confidences des gens. Je ne sais pas pourquoi. Peut-être parce qu'ils la pensent inoffensive... Peut-être qu'ils veulent la choquer. Mais maintes et maintes fois: les gens me vident ce qu'ils ont sur le coeur quand je joue Patricia. Ça ne se produit pas aussi souvent quand je suis Alex. Là, les gens me traitent avec plus... de respect ? D'attention ?
index_note_doctor_baroness_01;Le docteur et la baronne
a17_doctor_baroness_dialog_butler_01;Le docteur Gebhardt a t-il assassiné la baronne von Trebitz ? Qu'est-ce qu'ils avaient à voir ensemble ? Le médecin était tout sauf sympathique - tout comme la baronne... Mais à moins que leur rencontre soit dû à une réunion des antipathiques anonymes, je ne sais pas comment ces deux là ont bien pu se connaitre.
a18_doctor_baroness_story_01;Une histoire terrible. Un homme dont l'amour n'est pas partagé et qui rejette toute morale pour se venger. La baronne devait être absente de l'université à l'époque. C'est ce qui l'a empêchée d'être assassiné avec le reste de sa famille. Selon les photos, elle semble avoir connu Gebhardt... L'ami de la famille, leur sauveur, qui avait des vues sur la plus jeune soeur de la baronne. Elle l'a vu monter à bord du navire à Venise. Peut-être qu'elle n'était pas certaine que c'était vraiment vrai, ou peut-être qu'elle voulait avoir des preuves. Elle a cherché une photo, l'a trouvée et ensuite a voulu la montrer au docteur lors de la réception dans le salon. Malheureusement, le docteur lui l'avait bien reconnu et il se rendit immédiatement compte qu'elle pourrait détruire la vie nouvelle qu'il s'était construit après la guerre.
a18_doctor_baroness_doctor_dead_01;Tôt ou tard, les gens vont découvrir que le docteur Gebhardt ne pouvait pas être le Corbeau. Il va se révéler qu'il aura forcement un alibi pour l'un des vols. Mais ça pourrait prendre des jours, voire des semaines jusqu'à ce que cela arrive. Les vols ont eu lieu dans plusieurs pays il y a quinze ans. \n Peut-être qu'ils trouveront son corps, mais j'en doute. Le docteur Gebhardt - et peu importe qui il était avant - est mort.
index_museum_geheimtuer;Les Fils d'Horus
a11_soehne_des_horus;Hapi-Nord\n Kebechsenuef - Ouest\n Duamutef - Est\n Amset - Sud
a11_sdh_hapi;Hapi - Babouin
a11_sdh_amset;Amset - Humain
a11_sdh_duamutef;Duamutef - Chacal
a11_sdh_kebechsenuef;Kebechsenuef - Faucon
text_quest_default;Qui est le Corbeau ?
text_quest_default_content;Cherchez des indices et dévoilez l'identité du Corbeau.




























